{
  "userId": "usr_demo_0001",
  "date": "2026-01-06",
  "metrics": {
    "energy": 6,
    "stress": 7,
    "pain": 2,
    "libido": 5,
    "mood": 6,
    "sleep": {
      "durationMin": 390,
      "quality": 6,
      "bedtime": "06:20",
      "wakeTime": "12:50"
    },
    "hydration": {
      "targetMl": 2500,
      "actualMl": 1600
    }
  },
  "notes": "Service chargé. Objectif: récupération + marche douce.",
  "attachments": [
    {
      "type": "photo",
      "uri": "local://photos/2026-01-06_front.jpg",
      "thumbUri": "local://photos/thumbs/2026-01-06_front.jpg",
      "createdAt": "2026-01-06T13:00:00+01:00",
      "tags": [
        "progress",
        "front"
      ]
    },
    {
      "type": "audio",
      "uri": "local://audio/voice_note_2026-01-06.wav",
      "createdAt": "2026-01-06T13:02:00+01:00",
      "tags": [
        "journal",
        "voice"
      ]
    }
  ]
}